{
  "caller_ura": "easynet:///r/example/agent/alice.sdk",
  "callee_ura": "easynet:///r/example/agent/alice.pages",
  "subject_ura": "easynet:///r/example/agent/alice.pages",
  "descriptor_version": "1.0.0",
  "nonce_base64": "AQIDBAUGBwgJCgsMDQ4PEA==",
  "causal_context": {
    "form": "none"
  },
  "surface_ref": "easynet:///r/example/resource/alice.docs",
  "metadata": {
    "request_id": "surface-health-1"
  }
}
